position,name,type,isnumeric,format,vallab,varlab
1,case_id,str12,0,%12s,,Unique Household Identifier
2,hhid,strL,0,%32s,,Survey Solutions Unique HH Identifier
3,hh_g09,byte,1,%8.0g,hh_g09,"Over the past one week (7 days), did any people that you did nonlist as househol"
4,hh_g10a,byte,1,%8.0g,Id,ITEM CODE
5,hh_g10,byte,1,%8.0g,,What was the total number of days in which any meal was shared with people...
6,hh_g11,byte,1,%8.0g,,What was the total number of meals that were shared over past 7 days with...
